{
  "contract_version": "1.0",
  "task_id": "task-example",
  "task_type": "verify_remediation",
  "attempt": 1,
  "issued_at": "2026-01-01T00:00:00Z",
  "deadline": "2026-01-01T00:05:00Z",
  "labels": [
    "team=security"
  ],
  "input": {
    "issue_id": "issue-example"
  },
  "callback": {
    "url": "https://bureau.example.invalid/callback",
    "result_token": "placeholder-result-token"
  }
}
